{
  "policyKind": "coverage_gate",
  "version": 1,
  "effectiveFrom": "1970-01-01T00:00:00Z",
  "effectiveTo": null,
  "scope": { "tenantId": "00000000-0000-0000-0000-000000000000", "siteId": null, "unitId": null },
  "notes": "Seed default recorded 2026-10-07 from D05 ('based on proposed and standard'): 100 % accepted coverage before approval; approved substitutions count; time-proportional split of boundary-spanning output events allowed and marked estimated (ACT02) - the last flag was not asked explicitly and should be confirmed at the 2.4 gate. scope.tenantId is a placeholder that the seeder replaces.",
  "body": {
    "requiredCoverageRatio": 1,
    "allowProportionalEstimate": true,
    "countApprovedSubstitutionsAsAccepted": true
  }
}
